{
  "schemaVersion": "1.0.0",
  "generatedAt": "2026-08-08T10:53:20.106Z",
  "sourceCommit": "f0bcb2c4bfabeee4163d2dda8b41acd43abe1bc2",
  "repository": "https://github.com/RaghhavMalani/leetcode-progress",
  "declaredStats": {
    "solved": 128,
    "easy": 36,
    "medium": 73,
    "hard": 19
  },
  "problems": [
    {
      "number": 1,
      "slug": "two-sum",
      "directory": "0001-two-sum",
      "difficulty": "easy",
      "classification": {
        "label": "Hash map · complement lookup",
        "family": "Hashing"
      },
      "languages": [
        "py"
      ],
      "artifacts": {
        "notes": {
          "available": true,
          "path": "0001-two-sum/NOTES.md"
        },
        "trace": {
          "available": true,
          "path": "visualizations/0001-two-sum.html"
        }
      },
      "solutionHashes": {
        "0001-two-sum/0001-two-sum.py": "9579328d3c85334bd5004810e7291b7fe651096d2f6b71f3a12f22a1d6cef56f"
      },
      "firstSolvedAt": "2025-07-24T14:51:00+05:30",
      "lastSolvedAt": "2025-07-24T14:51:00+05:30",
      "reSolveHistory": []
    },
    {
      "number": 2,
      "slug": "add-two-numbers",
      "directory": "0002-add-two-numbers",
      "difficulty": "medium",
      "classification": {
        "label": "Linked list · digit-by-digit carry",
        "family": "Linked lists"
      },
      "languages": [
        "cpp",
        "java",
        "py"
      ],
      "artifacts": {
        "notes": {
          "available": true,
          "path": "0002-add-two-numbers/NOTES.md"
        },
        "trace": {
          "available": true,
          "path": "visualizations/0002-add-two-numbers.html"
        }
      },
      "solutionHashes": {
        "0002-add-two-numbers/0002-add-two-numbers.cpp": "34517053973cdb2fe8e07976c31934c180e91234e306fe3a0ecb049b4f3f4b03",
        "0002-add-two-numbers/0002-add-two-numbers.java": "a783d3755650a8b309fd65779d5af465b088b6e93c5a452072cece14a07c52ff",
        "0002-add-two-numbers/0002-add-two-numbers.py": "ee408fd3bf56c8112b3cd4b0ef51357a835674d4a943a16eecb9680da73c5f20"
      },
      "firstSolvedAt": "2025-07-26T22:25:01+05:30",
      "lastSolvedAt": "2026-06-15T21:14:00+05:30",
      "reSolveHistory": [
        {
          "sourceCommit": "24a013bab4e8029b099c232d869db62c5d3445a5",
          "solvedAt": "2026-06-15T18:05:31+05:30",
          "languages": [
            "cpp"
          ]
        },
        {
          "sourceCommit": "12c3799b6d01f126d5277b8f31e3e3a9dc2046b9",
          "solvedAt": "2026-06-15T21:14:00+05:30",
          "languages": [
            "java"
          ]
        }
      ]
    },
    {
      "number": 3,
      "slug": "longest-substring-without-repeating-characters",
      "directory": "0003-longest-substring-without-repeating-characters",
      "difficulty": "medium",
      "classification": {
        "label": "Sliding window · variable size",
        "family": "Two pointers & sliding window"
      },
      "languages": [
        "py"
      ],
      "artifacts": {
        "notes": {
          "available": true,
          "path": "0003-longest-substring-without-repeating-characters/NOTES.md"
        },
        "trace": {
          "available": true,
          "path": "visualizations/0003-longest-substring-without-repeating-characters.html"
        }
      },
      "solutionHashes": {
        "0003-longest-substring-without-repeating-characters/0003-longest-substring-without-repeating-characters.py": "1da7eab3743a93fe7112fd74ad7c238d119d20a1d64ddf324c5e6300780b739b"
      },
      "firstSolvedAt": "2025-07-26T23:34:26+05:30",
      "lastSolvedAt": "2025-07-26T23:34:26+05:30",
      "reSolveHistory": []
    },
    {
      "number": 14,
      "slug": "longest-common-prefix",
      "directory": "0014-longest-common-prefix",
      "difficulty": "easy",
      "classification": {
        "label": "Vertical scanning",
        "family": "Two pointers & sliding window"
      },
      "languages": [
        "py"
      ],
      "artifacts": {
        "notes": {
          "available": true,
          "path": "0014-longest-common-prefix/NOTES.md"
        },
        "trace": {
          "available": true,
          "path": "visualizations/0014-longest-common-prefix.html"
        }
      },
      "solutionHashes": {
        "0014-longest-common-prefix/0014-longest-common-prefix.py": "536544110133f0188fba1b5369b7448fe3bac0882ae85294f867da90f984cfb1"
      },
      "firstSolvedAt": "2025-07-31T15:56:51+05:30",
      "lastSolvedAt": "2025-07-31T15:56:51+05:30",
      "reSolveHistory": []
    },
    {
      "number": 17,
      "slug": "letter-combinations-of-a-phone-number",
      "directory": "0017-letter-combinations-of-a-phone-number",
      "difficulty": "",
      "classification": {
        "label": "",
        "family": ""
      },
      "languages": [
        "py"
      ],
      "artifacts": {
        "notes": {
          "available": false,
          "path": null
        },
        "trace": {
          "available": false,
          "path": null
        }
      },
      "solutionHashes": {
        "0017-letter-combinations-of-a-phone-number/0017-letter-combinations-of-a-phone-number.py": "5f006aeb7bb6d73fa60880b2f8083233f5ce86b32239d11dba60d10385f2f0de"
      },
      "firstSolvedAt": "2026-07-29T11:55:22+05:30",
      "lastSolvedAt": "2026-07-29T11:55:22+05:30",
      "reSolveHistory": []
    },
    {
      "number": 19,
      "slug": "remove-nth-node-from-end-of-list",
      "directory": "0019-remove-nth-node-from-end-of-list",
      "difficulty": "medium",
      "classification": {
        "label": "Linked list · two pointers with a gap",
        "family": "Two pointers & sliding window"
      },
      "languages": [
        "cpp",
        "java",
        "py"
      ],
      "artifacts": {
        "notes": {
          "available": true,
          "path": "0019-remove-nth-node-from-end-of-list/NOTES.md"
        },
        "trace": {
          "available": true,
          "path": "visualizations/0019-remove-nth-node-from-end-of-list.html"
        }
      },
      "solutionHashes": {
        "0019-remove-nth-node-from-end-of-list/0019-remove-nth-node-from-end-of-list.cpp": "341d2c62a6a34cdf3f9c64fe57c0330676d085c3a64b66902c1857665b35a9b9",
        "0019-remove-nth-node-from-end-of-list/0019-remove-nth-node-from-end-of-list.java": "297d57d1edf75ba3341d1e17131c8fa4041b90817a7101a33392480b6e4cff7c",
        "0019-remove-nth-node-from-end-of-list/0019-remove-nth-node-from-end-of-list.py": "fcc230d425bf642219085e36fcfbbc0e8b699fdf8072b27ee662fd190c2dee62"
      },
      "firstSolvedAt": "2026-06-15T13:19:35+05:30",
      "lastSolvedAt": "2026-06-15T13:32:35+05:30",
      "reSolveHistory": [
        {
          "sourceCommit": "533c66429a4d6eb85b2f884e1bc8490560eced82",
          "solvedAt": "2026-06-15T13:31:08+05:30",
          "languages": [
            "java"
          ]
        },
        {
          "sourceCommit": "08c13f289d248e0e7d9ade6065721ba69baf3dca",
          "solvedAt": "2026-06-15T13:32:35+05:30",
          "languages": [
            "cpp"
          ]
        }
      ]
    },
    {
      "number": 21,
      "slug": "merge-two-sorted-lists",
      "directory": "0021-merge-two-sorted-lists",
      "difficulty": "easy",
      "classification": {
        "label": "Linked list · dummy head + merge",
        "family": "Linked lists"
      },
      "languages": [
        "cpp",
        "java",
        "py"
      ],
      "artifacts": {
        "notes": {
          "available": true,
          "path": "0021-merge-two-sorted-lists/NOTES.md"
        },
        "trace": {
          "available": true,
          "path": "visualizations/0021-merge-two-sorted-lists.html"
        }
      },
      "solutionHashes": {
        "0021-merge-two-sorted-lists/0021-merge-two-sorted-lists.cpp": "4e64f26ed011a8714af26ab242a253fced6ab7d21131707b23da893774f95b98",
        "0021-merge-two-sorted-lists/0021-merge-two-sorted-lists.java": "cfd9750319ac043fb45d8c5fffd9f731260d1b24d39fdce2e4d83baf8537664b",
        "0021-merge-two-sorted-lists/0021-merge-two-sorted-lists.py": "a8fde7338894702e5bdcd50b20ca3f254cd9a7296d098b02a6d2171500af969c"
      },
      "firstSolvedAt": "2026-06-11T10:50:10+05:30",
      "lastSolvedAt": "2026-06-11T10:55:44+05:30",
      "reSolveHistory": [
        {
          "sourceCommit": "aea40e58789d87c95f6566894269766baeaaae11",
          "solvedAt": "2026-06-11T10:54:37+05:30",
          "languages": [
            "cpp"
          ]
        },
        {
          "sourceCommit": "2fa72a7c580e8b2e64ff9592180ab6d017001277",
          "solvedAt": "2026-06-11T10:55:44+05:30",
          "languages": [
            "py"
          ]
        }
      ]
    },
    {
      "number": 22,
      "slug": "generate-parentheses",
      "directory": "0022-generate-parentheses",
      "difficulty": "medium",
      "classification": {
        "label": "Backtracking · build-and-undo",
        "family": "Backtracking"
      },
      "languages": [
        "py"
      ],
      "artifacts": {
        "notes": {
          "available": true,
          "path": "0022-generate-parentheses/NOTES.md"
        },
        "trace": {
          "available": true,
          "path": "visualizations/0022-generate-parentheses.html"
        }
      },
      "solutionHashes": {
        "0022-generate-parentheses/0022-generate-parentheses.py": "0966eed16004cebfd3c74cbf37ac96a0d3e3e850834d5ad6fedaa4269effdc49"
      },
      "firstSolvedAt": "2026-07-26T21:49:31+05:30",
      "lastSolvedAt": "2026-07-26T21:49:31+05:30",
      "reSolveHistory": []
    },
    {
      "number": 23,
      "slug": "merge-k-sorted-lists",
      "directory": "0023-merge-k-sorted-lists",
      "difficulty": "hard",
      "classification": {
        "label": "Divide and conquer · pairwise merge",
        "family": "Sorting & divide and conquer"
      },
      "languages": [
        "py"
      ],
      "artifacts": {
        "notes": {
          "available": true,